{
  "sessionId": "11111111-1111-4111-8111-111111111115",
  "state": "STARTING",
  "generation": 0,
  "ownerClientId": "PLACEHOLDER-client-1",
  "targetComputerId": "computer-placeholder-01",
  "mode": "dictation",
  "audioStreaming": false,
  "engineCapturing": null,
  "probeStale": false,
  "lease": { "issuedAtMs": 1000, "expiresAtMs": 7000 },
  "updatedAtMs": 1200
}
