{
  "sessionId": "11111111-1111-4111-8111-111111111115",
  "state": "ACTIVE",
  "generation": 0,
  "ownerClientId": "PLACEHOLDER-client-1",
  "targetComputerId": "computer-placeholder-01",
  "mode": "dictation",
  "audioStreaming": true,
  "engineCapturing": true,
  "probeStale": false,
  "lease": { "issuedAtMs": 1000, "expiresAtMs": 301000 },
  "updatedAtMs": 2500
}
